{
  "schema_version": "1.0",
  "run_id": "20260712-1528-complete-copy-example",
  "objective": "Create a grounded lifecycle email for Product A.",
  "mode": "COPY",
  "phase": "ready",
  "readiness": "LAUNCH_READY",
  "performance": "NOT_MEASURED",
  "external_action_authorized": false,
  "open_decisions": [],
  "blocking_findings": [],
  "artifacts": [
    "ASSET-001"
  ],
  "created_at": "2026-07-12T15:28:55.493Z",
  "updated_at": "2026-07-12T15:30:22.224Z"
}
